Edgar Allan Poe	Como escribir un articulo de black wood		¡Aprende a escribir artículos como un maestro del horror! Edgar Allan Poe te enseña en Como escribir un articulo de black wood todas las técnicas que debes conocer para escribir un artículo de calidad. Poe también te explica cómo escribir un artículo para que sea publicado en revistas de prestigio. Un libro clásico que todos los escritores deberían leer al menos una vez en su vida.
Edgar Allan Poe	Como un leon		15 cuentos de terror de Edgar Allan Poe, considerado uno de los más importantes escritores de la literatura de horror. Como un león es un libro de cuentos que presenta algunos de los más famosos escritos de terror del autor, entre ellos "El corazón delator" y "La caída de la casa Usher". Un libro que no se querrá dejar de leer durante la noche, pero que también es perfecto para disfrutar durante el día, ya que los cuentos de Poe son maestros en la construcción de atmósfera.
Edgar Allan Poe	Conversacion con una madam		¡Lectura imprescindible! En Conversación con una madam, Edgar Allan Poe nos muestra la oscuridad de la mente humana. Este cuento es un ejemplo de la obra de este autor, que mezcla lo misterioso con lo absurdo, lo grotesco con lo lógico, lo sombrío con lo iluminado. Conversación con una madam es, sin duda, un texto que se debe leer si se quiere entender la psicología de la humanidad y el misterioso enigma de la conciencia.
Edgar Allan Poe	Conversacion con una momia		¡Atrevidos cuentos de Edgar Allan Poe! Conversación con una momia es uno de los cuentos más famosos y misteriosos del autor de las cuentas más oscuras. Edgar Allan Poe nos lleva de vuelta al tiempo de la antigua Egipto para contarnos la historia de una momia que vuelve a la vida para despertar un misterioso secreto. Un cuento de horror que se convierte en un clásico del género.
Edgar Allan Poe	Conversacion de eiros y charmion		¡Conversación de eiros y charmion!, es un cuento de Edgar Allan Poe que habla de la comunicación con los espíritus, de lo que se supone que ocurre en el mundo de los espíritus y de cómo se comunican con los vivientes. Es un cuento que hace pensar y que te lleva a reflexionar sobre lo que sucede después de la muerte. Es un cuento que se lee y se disfruta en cualquier ocasión.
Edgar Allan Poe	Cuatro bestias en una: el hombre camaleopardo     		¡Aprende a ser multifacético! El autor de "La caída de la casa Usher" os presenta en "Cuatro bestias en una" un personaje capaz de cambiar de rol y de carácter en función de la situación. Un texto que os ayudará a superar cualquier desafío.
Edgar Allan Poe	El alce	https://covers.openlibrary.org/b/id/13810612-L.jpg	¡El alce es un clásico de la literatura! Edgar Allan Poe es un autor clásico de la literatura misteriosa y de la literatura de terror. Este libro, El alce, es un relato corto que nos plantea un asesinato que ha sido cometido de una manera totalmente inusual. El autor nos conduce a través de una historia de misterio y terror hasta el final, donde se resuelve el enigma que ha estado oculto. ¡No se pierde la oportunidad de leer uno de los clásicos más importantes de la literatura de misterio!
Edgar Allan Poe	El angel de lo singular		1848. Poe está en Baltimore, en la pobreza absoluta. Se ha desgastado el mito de "el genio de la literatura", y el escritor se siente desesperado. Un día, mientras camina por las calles de la ciudad, se cruza con un extraño, un hombre que parece venir del futuro. El angelus es el relato más inquietante de Edgar Allan Poe, y en él el autor explora la maldición de la fama, el precio de la gloria y la muerte, tema central de su obra.
Edgar Allan Poe	El barril de amontillado		¡Qué más podéis pedir que un clásico como El barril de amontillado de Edgar Allan Poe para leer en Kindle! El autor que dio vida a los cuentos más famosos del horror nos presenta una de sus obras maestras. Un texto de 17 páginas que nos encerrará en la psicología del personaje principal. Un cuento que, como todos los de Poe, tiene una solución sorprendente y que os hará volver a leerlo dos veces.
Edgar Allan Poe	El corazon delator	https://covers.openlibrary.org/b/id/13163620-L.jpg	¡Terror y misterio en esta obra maestra de Edgar Allan Poe! El corazón delator es un cuento de misterio que se publicó por primera vez en el año 1843. El protagonista del relato, Montresor, es un hombre que se ha visto obligado a matar a su amigo Fortunato, porque creía que este le había roto una promesa. Pero el asesinato, lejos de ser un simple acto de venganza, está basado en una intriga más siniestra. Montresor se ha visto obligado a matar a Fortunato porque creía que este le había robado su corazón, un corazón que él había extraído de su propio pecho.
Edgar Allan Poe	El cottage de landor	https://covers.openlibrary.org/b/id/8104955-L.jpg	¡Es la obra maestra de Edgar Allan Poe! El Cottage de Landor es una novela corta que contiene una gran cantidad de elementos autobiográficos. Está llena de descripciones de la vida cotidiana en Londres, con un estilo de escritura que combina la precisión de la ciencia con la sensibilidad de la poesía. En definitiva, es un libro que no debe faltar en la biblioteca de cualquier lector de la literatura mundial.
Edgar Allan Poe	El cuento mil y dos de sherezada		¡Por fin! Edgar Allan Poe, uno de los autores más importantes de la literatura universal, recopilado en un solo volumen. El cuento mil y dos de Sherezada es, sin duda, el libro más conocido y completo del autor. Además, incluye otras obras de su autoría, como las más famosas: La caída de la casa Usher, El corazón arrojado, Los cuervos, El murciélago, La carta, El secretario, La mano enganchada, Ligeia, El hombre que se casó con la muerte, Berenice, Las lágrimas, el cuervo, El calabozo, El cuervo, El gato negro, El juicio final, El balde de sangre, El caserío, El cojo
Edgar Allan Poe	El cuervo	https://covers.openlibrary.org/b/id/9962937-L.jpg	¡Un clásico de la literatura! El cuervo es sin duda una de las obras maestras de Edgar Allan Poe. En este libro, el autor nos narra la historia de un hombre que está a punto de morir y que es visitado por un cuervo. El cuervo le hace preguntas sobre su vida y le recuerda momentos dolorosos de su pasado. La obra es llena de misterio, de sensación de muerte y de un estilo literario impresionante.
Edgar Allan Poe	El demonio de la perversidad	https://covers.openlibrary.org/b/id/4910804-L.jpg	¡Poe sigue sorprendiendo! En El demonio de la perversidad, nos presenta uno de sus trabajos más emocionantes y oscuros. Es una obra que se basa en la historia de un hombre que, durante un duelo, se obsesiona con un retrato y termina asesinando a la mujer que aparece en ella. La obra está llena de imágenes simbólicas y una atmósfera muy oscura que recuerda a la obra de Edgar Allan Poe, The Tell-Tale Heart.
Edgar Allan Poe	El diablo en el campanario		¡La literatura gótica sigue viva! El diablo en el campanario, de Edgar Allan Poe, es un relato de terror y misterio que se suma a los clásicos de la literatura del mismo género, como Frankenstein, Drácula o Jane Eyre. Edgar Allan Poe es un autor universalmente reconocido, y en este libro se lee la mejor de sus obras cortas.
Edgar Allan Poe	El dominio de arnheim o el paisaje del jardin		1834. Edgar Allan Poe publica en la revista literaria "Graham's Magazine" un ensayo titulado "El dominio de Arnheim o el paisaje del jardín", que es considerado como uno de los primeros textos teóricos del paisajismo. La obra de Poe es una de las obras más importantes para entender la relación entre la percepción del paisaje y la mente humana.
Edgar Allan Poe	El entierro prematuro		¡Cada día, cada momento, cada instante es un regalo de la vida! Esos son los sentimientos que nos deja Edgar Allan Poe en su poema El entierro prematuro. Uno de los poemas más famosos de este gran autor de la literatura estadounidense.
Edgar Allan Poe	El escarabajo de oro	https://covers.openlibrary.org/b/id/13489878-L.jpg	¡Atrapa al lector con una historia interesante y divertida! El escarabajo de oro es un relato de Edgar Allan Poe que nos lleva al mundo de la obsesión por el dinero y el poder. Un cuento que nos muestra la importancia de ser honesto y trabajadoros para alcanzar el éxito en la vida.
Edgar Allan Poe	El gato negro	https://covers.openlibrary.org/b/id/11865801-L.jpg	¡El maestro del cuento negro es de vuelta! El gato negro es una de las obras más emblemáticas de Edgar Allan Poe. Esta edición contiene la versión completa de la obra, con ilustraciones de la mano de Antonio Seguí. Un libro imprescindible para los amantes de la literatura de terror y misterio.
Edgar Allan Poe	El hombre consumido		¡Este libro es un clásico de la literatura! Edgar Allan Poe es considerado como uno de los grandes maestros de la literatura mundial. En El hombre consumido presentamos a un hombre que, al acercarse a la muerte, se ve envuelto en una trampa de horrores que lo llevarán a la locura. La historia es increíblemente emotiva y es un clásico de la literatura de terror y misterio.
Edgar Allan Poe	El hombre de la multitud		1845. Los estadounidenses comienzan a ser conscientes de la importancia que adquieren las masas en la política. Se produce un cambio en la forma de gobernar. En este contexto, Edgar Allan Poe escribe El hombre de la multitud, en la que analiza la influencia que ejercen las masas sobre los individuos. Un texto de vanguardia para su época.
Edgar Allan Poe	El hombre de negocios		¡Un clásico de la literatura empresarial que sigue vigente! En El hombre de negocios, Edgar Allan Poe ofrece consejos para ser exitoso en el mundo de los negocios que siguen siendo actuales. Este clásico del siglo XIX es una lectura imprescindible para cualquier emprendedor que quiera aprender de los mejores.
Edgar Allan Poe	El hundimiento de la casa usher		¡Cuántas veces se ha sentido asustado leyendo este clásico de la literatura! El hundimiento de la casa Usher es, sin duda, uno de los cuentos más famosos y populares de Poe. La historia cuenta la llegada de un narrador a la casa de su amigo Roderick Usher, quien se encuentra enfermedad mental y en un estado de gran angustia.
Edgar Allan Poe	El metodo del doctor tarr y del profesor fether		¡Vaya! Un libro para leer con la clara intención de adquirir habilidades psicológicas de detección! El método del doctor Tarr y del profesor Fether es un relato de Edgar Allan Poe, publicado en 1841. Se trata de un relato de misterio que cuenta la historia de un profesor de psiquiatría, el doctor Tarr, que, tras una grave enfermedad, es internado en un manicomio psiquiátrico que dirige él mismo. El profesor, al recuperarse, descubre que los pacientes se han rebelado contra él y se han apoderado del manicomio.
Edgar Allan Poe	El misterio de marie roget		¡Cuánto tiempo habían durado esos momentos! Cuánto tiempo habían durado esos momentos en los que yo, con el corazón agitado, había estado contemplando a aquella mujer tan hermosa! Me dije que mi amor por ella, de tan sólo unas horas, debe ser el más profundo del mundo.
Edgar Allan Poe	El poder de las palabras	https://covers.openlibrary.org/b/id/13239529-L.jpg	¡Este libro es un clásico! El escritor Edgar Allan Poe, considerado como uno de los principales innovadores de la literatura, nos presenta en El poder de las palabras, una obra maestra de la literatura. Un texto que aborda la importancia de las palabras y su impacto en nuestro entorno y en nuestras vidas. Un libro que se ha convertido en una referencia para todos los amantes de la literatura.
Edgar Allan Poe	El pozo y el pendulo		¡Misterio y terror en cada página! El autor más importante de la literatura de terror y misterio de la historia, Edgar Allan Poe, nos presenta dos de sus obras más emblemáticas: El pozo y El pendulo. En estas dos historias, nuestro autor nos muestra cómo llegar a la locura con pura lógica. En El pozo, el protagonista se encuentra atrapado en un pozo sin salida. Pensando que puede llamar la atención de alguien, empieza a gritar. Pero el más extraño es que nadie le escucha. Con el tiempo, el protagonista se desespera y se desmorona. En El pendulo, el protagonista se ve encerrado en una celda sin fin. Un pendulo pesa sobre su cabeza y cada vez que
Edgar Allan Poe	El retrato oval	https://covers.openlibrary.org/b/id/13145590-L.jpg	El escritor Edgar Allan Poe, con esta obra, ofrece una reflexión sobre la belleza y la percepción artística. El retrato oval es un texto que, aunque parezca ser un relato de ficción, es en realidad una obra de filosofía estética. En el retrato oval, Poe nos presenta a un retratista con una gran habilidad para captar la esencia de una persona, y conocemos a un hombre que es consciente de la belleza y la percepción artística. Poe nos muestra en esta obra que la belleza es más que una cuestión de aspecto físico, que es capaz de cambiar con el tiempo, sino que es algo más profundo y permanente que se encuentra en el alma de una persona.
Edgar Allan Poe	El rey peste		¡Este libro es un clásico de la literatura! El autor, Edgar Allan Poe, es considerado uno de los más importantes escritores de la historia de la literatura mundial. El rey peste es una de sus obras más conocidas y es un cuento de terror que te asegurará que no os duermas nunca más. ¡Esperemos que disfrutéis leyendo este clásico como si fuera la primera vez!
Edgar Allan Poe	Eureka	https://covers.openlibrary.org/b/id/13580994-L.jpg	¡Aprende a descubrir la genialidad! Edgar Allan Poe, considerado el padre del misterio, nos enseña en este libro, Eureka, cómo descubrir la genialidad. Poe se propone en este texto explicar cómo descubrir la luz de la verdad en la oscuridad. Un libro que desvela la esencia del pensamiento genial y que nos ayuda a comprender cómo hacerlo. Un texto claro, conciso y que te lleva a reflexionar sobre la genialidad y cómo encontrarla en ti mismo.
Edgar Allan Poe	Extraordinarios casos		100 historias de misteriosos y asombrosos sucesos que nos llevan a reflexionar sobre la vida y lo que realmente es posible. Extraordinarios casos es un libro que se une al lector con la belleza y la fuerza de los mejores relatos de Edgar Allan Poe.
Edgar Allan Poe	Hop frog	https://covers.openlibrary.org/b/id/5268934-L.jpg	¡Este clásico de la literatura estadounidense llega a Kindle! Hop-Frog es una de las obras más interesantes de Edgar Allan Poe, que combina el horror con la ironía y la sátira, y que es considerada una de las mejores obras del autor, y una de las más importantes de la literatura mundial. Es una de las obras más difíciles de entender de Poe, pero también una de las más interesantes y originales. Hop-Frog es un relato corto, que combina la ironía, el horror y la sátira, y que nos lleva a la corte de un rey, que comete una grave falta, y que será castigada con la ayuda de Hop-Frog, el payaso de la corte, que se vengará de su
Edgar Allan Poe	La caida de la casa usher		¡Poe en español! El clásico cuento del autor de las cuentos de misterio y terror ha llegado a la biblioteca de audiolibros en voz de Juan José Márquez. ¡Escúchalo y disfruta de esta clásica obra literaria de Edgar Allan Poe!
Edgar Allan Poe	La caja oblonga		¡Jugar con el misterio de la muerte es peligroso! La caja oblonga es un cuento de Edgar Allan Poe que nos lleva a un juego de enigmas y misterios que podrían acabar con la vida. La caja oblonga es un cuento que podrá despertar tu imaginación y tu curiosidad, y te invita a resolver los enigmas que contiene.
Edgar Allan Poe	La carta robada		¡Encuentra a Poe en su mejor momento! La carta robada es una de las obras más emblemáticas del autor de las cuentos más misteriosos y asombrosos de la literatura universal. Esta edición presenta la traducción más fiel posible, con la colaboración de los mejores filólogos en la materia, y un estudio introductorio que ayuda a comprender la obra.
Edgar Allan Poe	La cita	https://covers.openlibrary.org/b/id/4477921-L.jpg	¡Cuidado con las citas! Esas frases emocionantes que nos hacen recordar lo mejor de la literatura o el cine, y que nos parecen tan bonitas en un cartel, en una tarjeta de cumpleaños o en un texto de Facebook, pueden cambiar completamente de significado si se usan equivocadamente. Edgar Allan Poe, autor de la célebre frase "el más grande error es el error de pensar que el error es un crimen", no se equivocó al escribir "la cita sin contexto es como la mujer sin ropa, se ve desnuda a los ojos del que la conoce".
Edgar Allan Poe	La durmiente	https://covers.openlibrary.org/b/id/13981958-L.jpg	¡Cuento clásico de la literatura! En La durmiente, Poe nos lleva a un sueño y nos deja atrapados en el mundo onírico, donde la muerte y la vida se confunden. Un texto oscuro y misterioso que nos deja en trance.
Edgar Allan Poe	La esfinge	https://covers.openlibrary.org/b/id/7347438-L.jpg	¡Misterioso y fascinante! La esfinge es un relato de Edgar Allan Poe que se publicó por primera vez en 1847. La obra es una mezcla entre la mitología griega y la realidad de la época en la que se desarrolla la acción. En La esfinge, el autor nos lleva a un paisaje desértico y a una mujer misteriosa que es capaz de llevar a la locura a los hombres que la ven. La historia es un verdadero enigma, y el lector se verá desafiado para descubrir su significado.
Edgar Allan Poe	La incomparable aventura de un tal hans pfaall	https://covers.openlibrary.org/b/id/13931479-L.jpg	¡Mundo sin gravedad! Esa es la premisa de este clásico del autor de la misteriosa muerte de la novia de Monsieur Lopez y de las cuentos más escabrosos de la literatura mundial. La incomparable aventura de un tal Hans Pfaall es una de las obras maestras del escritor estadounidense Edgar Allan Poe, en la que se mezclan la ciencia ficción, la ironía y el humor. Esperemos que disfrutes de este libro y que nos compartas en las redes tu opinión.
Edgar Allan Poe	La isla del hada	https://covers.openlibrary.org/b/id/11622355-L.jpg	¡Qué leer para los más pequeños de la casa! Un cuento de hadas para leer con ellos durante las tardes más largas del fin de semana. Un relato clásico de Edgar Allan Poe, que les atraerá con su trama mágica y la ilustración de José M. Pujol.
Edgar Allan Poe	La mascara de la muerte		¡Cuántas veces hemos leído este cuento y hemos asustado?! Es posible que quieras volver a leerlo y asustarte de nuevo. Edgar Allan Poe es uno de los autores más importantes de la literatura mundana y este cuento es uno de sus clásicos.
Edgar Allan Poe	La perdida del aliento		14 cuentos completos de Edgar Allan Poe, incluido el clásico "La caída de la casa Usher", junto con "El corazón arrogante", "El misterio de Marie Rogêt", "La muerte de un viajante", "La cerrada puerta", "El cuervo", "El muerto", "El péndulo", "Los cuentos de la melancolía y de la muerte", "El hombre de las multitudes", "El misterio del mariscal", "El misterio de Mesmerismo", "La máscara de la muerte" y "La perdida del aliento".
Edgar Allan Poe	La vida literaria de thingum bobu		¡Thingum Bobu! ¡Ugh! ¡Thingum Bobu! ¡Ugh! ¡Thingum Bobu! ¡Ugh! ¡Thingum Bobu! ¡Ugh! ¡Thingum Bobu! ¡Ugh! ¡Thingum Bobu! ¡Ugh! ¡Thingum Bobu! ¡Ugh! ¡Thingum Bobu! ¡Ugh! ¡Thingum Bobu! ¡Ugh! ¡Thingum Bobu! ¡Ugh! ¡Thingum Bobu! ¡Ugh! ¡Thingum Bobu! ¡Ugh! ¡Thingum Bobu! ¡Ugh! ¡Thingum Bobu! ¡Ugh! ¡Thingum Bobu! ¡Ugh! ¡Thingum Bob
Edgar Allan Poe	Las aventuras de arthur gordon pym	https://covers.openlibrary.org/b/id/13668766-L.jpg	¡Aventura y misterio en una sola obra! Edgar Allan Poe nos entretiene con esta historia que se convierte en una obsesión para los lectores. Las aventuras de arthur gordon pym es un clásico de la literatura que sigue siendo un delicia para los amantes del misterio y la aventura.
Edgar Allan Poe	Ligeia	https://covers.openlibrary.org/b/id/5269787-L.jpg	¡Las obsesiones de Poe! En Ligeia, la novela corta más famosa del autor, se narra la historia de un hombre que se enamora de una mujer misteriosa, Ligeia, que parece haber muerto y regresado a la vida, pero con un cuerpo muy delicado. Cada vez que se despierta, se vuelve más frágil, lo que lleva a que el protagonista se preocupe por su fragilidad y busque una forma de salvarla.
Edgar Allan Poe	Los crimenes de la rue morgue	https://covers.openlibrary.org/b/id/14009682-L.jpg	¡Un clásico del misterio y la literatura negra! Este relato corto de Edgar Allan Poe es un verdadero clásico de la literatura negra y el misterio. Está considerado como uno de los primeros relatos policiales y la base del género. Los crímenes de la rue morgue es un texto de lectura obligada para todos los amantes de la literatura negra y el misterio.
Edgar Allan Poe	Los extraordinarios casos de monsieur dupont		16 cuentos extraños y divertidos de Edgar Allan Poe, escritos en un estilo que mezcla la lógica con la irracionalidad, la razón con el misterio. Estos cuentos fueron los que permitieron a Poe ser considerado como el padre del relato de misterio moderno.
Edgar Allan Poe	Los hechos en el caso de m. valdemar		1ª Edición de Los hechos en el caso de m. Valdemar. Toqué: Tapa dura. Tamaño: 16,5 x 22 cm. 64 páginas.
Edgar Allan Poe	Los impertinentes	https://covers.openlibrary.org/b/id/5516411-L.jpg	10 cuentos de Edgar Allan Poe para disfrutar y asustarse en igual medida. Los impertinentes es un libro que recopila los diez mejores cuentos de terror del autor estadounidense, que se considera uno de los precursores del género. Entre sus obras más famosas se encuentran "El cuervo", "La cámara oscura", "El corazón arrojado" y "La caída de la casa Usher". Un libro esencial para cualquiera que quiera aproximarse al mundo de la literatura de terror.
Edgar Allan Poe	Manuscrito hallado en una botella		¡Aventura, misterio y romance en una sola novela! Manuscrito hallado en una botella de Edgar Allan Poe es una obra maestra de la literatura que ha sorprendido a generaciones de lectores. La trama gira en torno a un manuscrito que un náufrago encuentra en una botella y que narra la historia de un hombre que fue condenado a muerte, pero que logró escapar y vivir durante varios años en una isla desierta. Es una novela de suspenso y misterio que sigue siendo una obra de referencia en la literatura.
Edgar Allan Poe	Marginalia-fragmentos		¡Basta ya de Poe!, exclamó el lector de este blog ayer al ver el título de este post. Y se equivocaba, porque Marginalia-fragmentos es un libro de textos dispersos y sin orden de Edgar Allan Poe. Un libro que muestra la faceta menos conocida del autor de las cuentos más famosos de la literatura universal. Un libro que demuestra que el autor de "El cuervo" y "La caída de la casa Usher" también podía ser humorista y divertido.
Edgar Allan Poe	Mellonta tauta		¡Atrevido y desconocido! Mellonta tauta es un texto de Edgar Allan Poe que sigue la historia de un hombre que recibe un mensaje extraño que habla de un evento desconocido que ocurrirá en el futuro. Un texto que se encuadra en la literatura de ciencia ficción y que nos lleva a reflexionar sobre el tiempo y la manera en que la humanidad se relaciona con él.
Edgar Allan Poe	Metodo de composicion	https://covers.openlibrary.org/b/id/12075788-L.jpg	
Edgar Allan Poe	Metzengerstein	https://covers.openlibrary.org/b/id/11762960-L.jpg	¡Cuidado con la electricidad! Edgar Allan Poe nos presenta en Metzengerstein a la electricidad como un elemento peligroso que puede causarnos daños irreparables. Un cuento clásico de horror que sigue siendo un clásico del género y que demuestra la maestría de Poe en la construcción de atmósfera y suspense. Un cuento que sigue siendo un clásico del género y que demuestra la maestría de Poe en la construcción de atmósfera y suspense.
Edgar Allan Poe	Morella	https://covers.openlibrary.org/b/id/11622355-L.jpg	¡Volveremos a la oscuridad más absoluta! Morella es el cuento más oscuro de Edgar Allan Poe. El autor, en uno de sus textos más emblemáticos, nos presenta a un joven que cree que el destino le ha traído la muerte, pero que también le ha dado la oportunidad de entender el secreto de la vida. Poe, en esta obra, nos lleva a la muerte y nos permite observarla desde un punto de vista inesperado.
Edgar Allan Poe	Narrativa completa	https://covers.openlibrary.org/b/id/4904908-L.jpg	¡Nueva colección de Edgar Allan Poe! En esta ocasión, recopilamos su obra completa de narrativa corta. Un título que no puede faltar en la biblioteca de cualquier lector de literatura clásica.
Edgar Allan Poe	Poemas	https://covers.openlibrary.org/b/id/11622355-L.jpg	¡Colección completa de los mejores poemas de Edgar Allan Poe! Este libro incluye los poemas más famosos de Edgar Allan Poe, como "El corazón desesperado", "El rato de los pájaros", "Lenore", "El murciélago", "Annabel Lee", "La caída de la casa Usher", "La campana" y muchos más. Estos poemas han sido adaptados al cine y la televisión, y son un clásico de la literatura universal. Poesía oscura, misteriosa y emocionante, que se adapta a cualquier gusto.
Edgar Allan Poe	Revelacion mesmerica		136 páginas.
Edgar Allan Poe	Silencio	https://covers.openlibrary.org/b/id/13145590-L.jpg	¡Es hora de volver a leer a Edgar Allan Poe! Silencio es el último trabajo de este autor, que apareció en 1848. Es un poema en el que Poe reflexiona sobre la muerte y el fin de las cosas. Como siempre, el estilo de Poe es exquisito y el lector se verá envuelto en el enigma que encierra esta última obra.
