Rafael Alberti	Amaranta	https://covers.openlibrary.org/b/id/11212792-L.jpg	1936. Madrid está en manos de los sublevados y Amaranta ha sido enviada con otros niños a vivir con tías en la campiña. Allí descubre la belleza de la naturaleza y la magia de la poesía. Amaranta es una novela que habla de la infancia, del amor y de la esperanza. Amaranta es una novela que habla de la vida.
Rafael Alberti	El prisionero	https://covers.openlibrary.org/b/id/10107769-L.jpg	50 años después de su publicación, "El prisionero" sigue siendo una obra maestra del poeta Rafael Alberti. El libro, con dibujos de Joan Miró, es un diálogo entre el autor y su propio alma, un diálogo con la libertad, la justicia, el amor y la muerte.
Rafael Alberti	Elegia a garcilaso		¡Celebración del amor! Elegía a garcilaso es el libro de poemas más emblemático de Rafael Alberti. Su amor por la poesía es contagioso, y con sus versos ha logrado que seamos conscientes del poder de los sentimientos. Es un libro que habla de la pasión, de la belleza, de la sensualidad y de la vida. Es una obra maestra que sigue siendo actual y de la que todavía se pueden aprender lecciones.
Rafael Alberti	La arboleda perdida	https://covers.openlibrary.org/b/id/4445186-L.jpg	1932. La España del Bienio Negro se sumerge en la violencia de la represión franquista. El joven poeta Rafael Alberti, preso en la cárcel de Carabanchel, se encuentra con otros compañeros que han perdido la fe y el entusiasmo revolucionario. Entonces se decide a llevarles la llama de la esperanza y la pasión por la poesía. ¡La arboleda perdida es la mejor película de la historia del cine!
Rafael Alberti	Lo que deje por  ti		¡Qué maravilla! Lo que deje por ti es el libro más completo de Alberti. Aquí encontramos todos sus poemas más famosos y algunos que nunca antes se habían publicado. Lo que deje por ti es un libro que recopila más de 600 poemas, con una selección de fotografías de la autora, que recuerdan la vida de Rafael Alberti. Es un libro que recopila más de 600 poemas, con una selección de fotografías de la autora, que recuerdan la vida de Rafael Alberti.
Rafael Alberti	Madrigal al billete de tranvia		47 poemas de Rafael Alberti, que nos llevan desde la infancia hasta la vejez, desde el amor hasta la muerte, desde el paisaje hasta la noche y la luna. Madrigal al billete de tranvia es una obra maestra de la poesía del siglo XX que recorre todas las facetas de la existencia humana.
Rafael Alberti	Marinero en tierra	https://covers.openlibrary.org/b/id/2269886-L.jpg	Marinero en tierra es el primer libro de la obra poética de Rafael Alberti. Fue publicado en 1929 y es considerado como uno de los textos más importantes de la literatura española del siglo XX. En él se refleja la intención de Alberti de romper con la tradición y la conformidad. El libro contiene 62 poemas en los que se abordan temas como el amor, la muerte, la política y el paisaje. Alberti emplea una forma poética modernista, con una estructura libre y un lenguaje coloquial, que le permitía comunicar mejor sus ideas. Marinero en tierra es un ejemplo de la literatura surrealista, que se puede apreciar en la presencia de imágenes irracionales y la utilización del subconsciente.
Rafael Alberti	Nocturno (del alba del alheli)		¡Qué poesía! Rafael Alberti, uno de los más importantes poetas de la Generación del 27, nos regala en Nocturno (del alba del alheli) una obra poética que mezcla el amor con la muerte y lo hace de manera impresionante. En este libro Alberti nos muestra que la muerte no es algo negativo, sino algo que completa la vida. Nocturno (del alba del alheli) es un libro de poemas en el que el lector se identificará con la belleza y la sensualidad.
Rafael Alberti	Nocturno (del roma peligro para caminantes) 		¡Buenas noches, caminante! Nunca olvides que, en la noche, todo cambia. Con este poema, Rafael Alberti nos invita a reflexionar sobre el cambio y la transformación que se produce en la noche, desde la perspectiva de un caminante. El poema, con su ritmo y melodía, es una invitación a disfrutar de la noche y de todo lo que se desvela en ella.
Rafael Alberti	Pinosanguinochetburunda		137 poemas de Rafael Alberti que han sido traducidos al catalán por Maria-Mercè Marçal y que se han reunido en este libro publicado por Ediciones B. La selección ha sido realizada por Pere Gimferrer, presidente de la Fundación Rafael Alberti. Entre los poemas que se pueden leer en este libro están "A la Virgen del Val", "Noche en Venecia", "La boca del mundo", "La ballena", "La catedral de Salamanca", "La flor de la canya", "La lluna" y "La màquina".
Rafael Alberti	Poesias (selección)		20 poemas de Rafael Alberti, elegidos entre sus obras más conocidas y reconocidas. Se trata de una selección que abarca toda su etapa poética, desde la publicación de La barca de la noche en 1927 hasta la de La ciudad mágica en 1967.
Rafael Alberti	Retornos de una sombra maldita		1939. El poeta Rafael Alberti es arrestado por la policía franquista y condenado a muerte. Conduce a la cárcel modelo de Madrid, donde le espera un destino desconocido. En su celda, Alberti vive un viaje interior, reviviendo momentos de su vida que lo llevarán a la luz.
Rafael Alberti	Retornos del amor en la noche triste		¡Por fin!, ha llegado la primera edición de Retornos del amor en la noche triste, del gran Rafael Alberti, uno de los poetas más importantes de la literatura universal. El libro está lleno de emoción, pasión, sensualidad, y se encuentra entre los mejores poemarios que he leído en mi vida.
Rafael Alberti	Retornos del amor en los vividos paisajes		¡Esperemos que no os olvideis de Rafael Alberti! Retornos del amor en los vividos paisajes es una selección de poemas de uno de los más importantes poetas del siglo XX. Alberti, que murió hace unas semanas, aborda en estos poemas el amor desde una perspectiva muy personal y con una gran belleza lírica. Un libro que tiene que ser en cualquier biblioteca.
Rafael Alberti	Retornos del amor en una azotea		12 poemas escritos en 1934 por Rafael Alberti, durante el tiempo que estuvo exiliado en París. Uno de los clásicos de la poesía española del siglo XX.
Rafael Alberti	Retornos del amor tal como era		100 poemas seleccionados del gran poeta Rafael Alberti. Un recorrido por la poesía del amor, del tiempo y de la vida. Alberti sigue siendo uno de los poetas más importantes del siglo XX y estos poemas son una muestra del talento que tenía.
Rafael Alberti	Sobre los angeles	https://covers.openlibrary.org/b/id/2270382-L.jpg	Íntima conversación con los ángeles que habitan en la Casa de la Meditación de Granada, fundada por el poeta Rafael Alberti en 1956. Un diálogo entre el autor y los ángeles que explora el misterio del ser, la creación, el amor y la muerte. Un texto reflexivo y poético que invita al lector a descubrir su propia dimensión espiritual.
Rafael Alberti	Tal vez, oh mar...		¡Cuidado con el poeta! Rafael Alberti nos lleva por la mano para que nos sumergamos en su paisaje emocional. Tal vez, oh mar... es un libro de poemas que nos hace sentir y que nos invita a vivir intensamente cada momento.
Mitch Albom	Cinco personas que encontraras en el cielo	https://covers.openlibrary.org/b/id/13731161-L.jpg	5 personas que encontrarás en el cielo es una obra de Mitch Albom, autor de la novela Tuesdays with Morrie, que sigue con la misma temática. Cinco personas que encontrarás en el cielo es la historia de 5 personas que han muerto y han vuelto a la tierra para enseñarnos una lección. En este libro, Albom nos enseña que la vida es un regalo, que cada día es una oportunidad para aprender y crecer. La historia es contada con estilo, llena de anécdotas y detalles que captan la atención del lector.
Mitch Albom	Martes con mi viejo profesor	https://covers.openlibrary.org/b/id/13938724-L.jpg	20 años después de que el profesor Kaufman se retirara, el escritor Mitch Albom se reencuentra con el hombre que cambió su vida. Desde su silla de ruedas, Kaufman sigue impartiendo lecciones valiosas sobre la vida, la amistad y el amor. Albom nos lleva de vuelta a los tiempos en que estaba en la universidad y a las clases del profesor más inspirador que ha conocido.
Carmen Alborch	Solas	https://covers.openlibrary.org/b/id/8789658-L.jpg	¡Solas, un gran éxito literario de Carmen Alborch! Un libro que se convierte en un hito en la literatura española, ganador de numerosos premios, y que se ha convertido en un referente para todas aquellas mujeres que quieran superar el divorcio y la separación con valentía. En Solas, Carmen Alborch nos acompaña con unas palabras que nos ayudan a superarnos a nosotras mismas y a superar la pérdida de la pareja.
Orlando Albornoz	El valor de savater		¡Orlando Albornoz nos vuelve a sorprender con un texto sobre Miguel Ángel Savater que combina la erudición con la sencillez! El autor nos muestra cómo a través de la lectura de los escritos de Savater se puede comprender mejor nuestro mundo y cómo podemos vivir mejor. El libro es fácil, ameno y cargado de consejos que nos ayudarán a entender mejor nuestra realidad cotidiana.
Orlando Albornoz	Hacia donde vamos en educacion		¡Educación es la clave del futuro!, grita el autor del presente libro. Y eso es cierto, pero ¿qué es lo que realmente queremos de la educación? Orlando Albornoz, director de la Fundación para la Educación Liberal y Demócrata (FELDE), presenta en este libro un modelo alternativo, basado en el liberalismo, para la enseñanza de la educación. Un modelo que permite que cada estudiante decida qué aprender, cómo aprenderlo y cuándo aprenderlo. Un modelo que permite que cada estudiante decida qué aprender, cómo aprenderlo y cuándo aprenderlo. Un modelo que permite que cada estudiante decida qué aprender, cómo aprenderlo y cuándo aprenderlo. Un modelo que permite que cada estudiante decida qué
Jose F. Alcantara	La sociedad de control	https://covers.openlibrary.org/b/id/13981958-L.jpg	¡Qué es lo que nos esconden detrás de nuestro celular, nuestro ordenador y nuestra televisión?! Jose F. Alcantara nos presenta en su libro La sociedad de control, una visión profética de lo que podría ser el futuro si no cambiamos de actitud. Un texto lleno de reflexión y sensación que invita al lector a que se pregunte si realmente queremos vivir en una sociedad de control.
Ricardo Alcantara	El aguijon del diablo	https://covers.openlibrary.org/b/id/8373670-L.jpg	¡Cuántas veces se nos ha cruzado el camino con el aguijón del diablo! Esas situaciones tan desagradables que nos hacen sentir indignados y dolidos. Ricardo Alcantara nos enseña en este libro cómo superarlas y cómo convertir las malas situaciones en oportunidades de crecimiento.
Louise May Alcott	Bajo las lilas	https://covers.openlibrary.org/b/id/11345314-L.jpg	1868. Jo March, la más rebelde de las hermanas, ha decidido abrir un salón literario en casa. Pero sus planes se ven truncados cuando un misterioso visitante se presenta en la puerta de la casa.
Louise May Alcott	Bee bee	https://covers.openlibrary.org/b/id/4523946-L.jpg	¡Encuentra este libro para descargar y lee la historia de Beebee, un niño huérfano que vive con sus tíos! Louise May Alcott, autora de Las cuatro hermanas, nos presenta en Beebee un niño hermoso, valiente y bondadoso que se enfrenta a muchas dificultades, pero que siempre se mantiene firme y optimista. Un libro para disfrutar con toda la familia, lleno de valores morales y lecciones para los niños.
Louise May Alcott	El buen  duende y la princesa		Cuento infantil que habla de la amistad y la imaginación. Está ambientado en la Edad Victoriana y se basa en la historia real de las dos niñas. La princesa es la hija de un duque que se muda con su madre a un castillo. Allí conoce a Jo, la niña del pueblo que sueña con ser escritora. Jo es un poco fea y a veces se muestra un poco fuerte, pero es muy divertida y ama la imaginación. Con la llegada de la princesa, Jo se ve obligada a cambiar su estilo de vida, pero pronto descubre que también puede ser amiga de la princesa y juntas pueden tener mucho más divertido que solo leer libros.
Louise May Alcott	El mantel de tabby		¡La primera novela de la autora de Little Women! Louise May Alcott publicó "El mantel de tabby" en 1868 bajo el seudónimo de A. M. Barnard. Esta novela se centra en la heroína Polly y su vida en una comunidad de Quakers.
Louise May Alcott	Excursion accidentada		¡Excelsa novela para niños y adultos! Excursión accidentada es el libro más popular de la autoría de Louise May Alcott, escritor y poetisa estadounidense de gran fama en su época. La obra es una especie de diario de viaje que narra la aventura de cuatro niñas, que se han metido en una gran expedición por la selva. ¡No seas tú más tarde que ayer, lee Excursión accidentada y disfruta de una gran obra literaria!
Louise May Alcott	Hombrecitos	https://covers.openlibrary.org/b/id/12774038-L.jpg	12 historias cortas, divertidas y llenas de enseñanza, que nos cuentan sobre la infancia. Louise May Alcott, autora de la clásica novelas Las cuatro hijas y Jo's Boys, presenta a través de Hombrecitos un libro ideal para compartir con los más pequeños de la casa.
Louise May Alcott	Jack y jill		¡Jack y Jill, el clásico del pasado para el presente! Estos hermanos se disfrutan de aventuras y se aprenden valores como el trabajo duro, la amistad y el amor por la familia. Un libro perfecto para leer con los niños y que les enseñe valores que les serán útiles toda la vida.
Louise May Alcott	La clase de cocina	https://covers.openlibrary.org/b/id/13981958-L.jpg	¡Aprende a cocinar con Louise May Alcott! En La clase de cocina, el autor nos presenta un recorrido por la cocina del siglo XIX, con la ayuda de Jo March, una de las heroínas de su novela clásica, Las cuatro hermanas. Un libro de cocina divertido y útil que nos enseña algunos de los secretos de la cocina de hace más de un siglo.
Louise May Alcott	La fiesta de los cubiertos		¡Nadie se queda sin comer en este banquete de dulces y platos! Louise May Alcott nos invita a disfrutar de esta fiesta de comida para niños y adultos en La fiesta de los cubiertos. Un libro con ilustraciones de Mercer Mayer que llena de humor y alegría.
Louise May Alcott	La liebre y la tortuga		¡Muy interesante! Me gusta mucho esta parábola, es muy didáctica. La moral es muy clara y es que hay que ser pacientes, persistir, y no desistir hasta lograr nuestros objetivos. Es una lección de vida que todos deberíamos aprender desde pequeños y que a menudo se nos olvida con los años.
Louise May Alcott	Las mujercitas se casan		¡Las chicas se casan!, es un clásico de la literatura infantil y juvenil. Uno de esos libros que es tradición leerlos en la infancia. Escrito por Louise May Alcott, es una obra maestra que sigue siendo popular entre los niños y los adultos. Está basada en la vida de la autora y sigue la historia de cuatro hermanas que buscan su camino en el mundo, cada una con sus propias dificultades y deseos. Es un libro lleno de emoción, amistad y amor.
Louise May Alcott	Merienda	https://covers.openlibrary.org/b/id/11622355-L.jpg	¡Merienda es delicioso y divertido! Una maravillosa historia para recrearse y aprender. Louise May Alcott nos acerca a la vida de un grupo de niños y niñas en la escuela y en el hogar. Merienda es una clase magnífica para aprender a leer, porque es divertido y fácil. Está lleno de historias cortas, divertidos cuentos y juguetes para leer y jugar.
Louise May Alcott	Mujercitas	https://covers.openlibrary.org/b/id/8256549-L.jpg	¡Más de 150 años después de su publicación, Mujercitas sigue siendo una obra maestra de la literatura infantil y juvenil! El libro tiene como protagonista a Jo March, una niña con gran fuerza de voluntad y un espíritu rebelde que, junto a sus hermanas Beth, Meg y Amy, se enfrenta a los desafíos de la vida en un momento histórico que transcurre en la postguerra de la Guerra de Secesión. Mujercitas es una obra llena de enseñanzas y emoción, que sigue siendo un clásico de la literatura universal.
Louise May Alcott	Musica y macarrones		¡Mira qué regalo para los amantes de la literatura y la cocina! Musica y macarrones es un libro que mezcla dos de mis pasiones más, la lectura y la cocina. Un placer para los ojos y para los paladares.
Louise May Alcott	Ocho primos		8 cuentos de Louise May Alcott, que se publicaron originalmente en la revista Atlantic Monthly entre 1869 y 1882, que han sido reunidos en este volumen. Se trata de historias de intriga, humor y reflexión, con una perspectiva histórica que abarca la Guerra Civil y la posguerra.
Louise May Alcott	Otra mujercita	https://covers.openlibrary.org/b/id/8741280-L.jpg	
Louise May Alcott	Un hueco en la pared		¡Un hueco en la pared!, la historia más emocionante de Louise May Alcott, autora de la famosa "Casa de la Pradera". Una de las mejores obras de literatura infantil y juvenil, con una traducción de la más alta calidad, ilustrada con los dibujos originales de la propia autora.
Louise May Alcott	Una niña anticuada	https://covers.openlibrary.org/b/id/3345177-L.jpg	¡Este es el libro que todo el mundo debe leer! Una niña anticuada, de Louise May Alcott, es uno de esos libros clásicos que, además de ser un clásico, es una lección de vida. Una niña anticuada, es un libro que habla de amor, de amistad, de la fuerza de la voluntad y del compromiso. Es un libro que habla de ser un ser humano mejor, más compasivo, más justo y más solidario. Es un libro que habla de ser feliz.
Ignacio Aldecoa	Los pajaros de baden baden y otros relatos		15 cuentos que reflejan la mente y la sensibilidad del escritor. Los pajaros de Baden Baden y otros relatos es un libro de lectura obligada para aquellos que quieran entender el camino del escritor y cómo se va conociendo a sí mismo.
Josefina Aldecoa	Historia de una maestra	https://covers.openlibrary.org/b/id/10128928-L.jpg	1936. Ana es maestra en una escuela rural de la campiña asturiana. Se ha casado con Miguel, un republicano, y están a punto de tener su primer hijo. La guerra civil está a punto de estallar. El libro de Josefina Aldecoa sigue el destino de Ana, de sus amigos y familiares durante la Guerra Civil y la posguerra, a través de la perspectiva de una mujer. Una obra maestra de la literatura histórica.
Hanny Alders	El señor de los cataros	https://covers.openlibrary.org/b/id/7888278-L.jpg	¡Qué sorprendente libro! ¡Pero, ¿qué es lo que es esto? ¡Es el relato de la vida de un hombre cuya vida ha estado marcada por una enfermedad rara y dolorosa! ¡Mi Dios! ¡Qué dolor, qué lágrimas, qué penas! ¡Pero, ¡qué historia! ¡Y qué escritura! ¡Este libro es un ejemplo de lo que es la verdadera literatura! ¡Este libro es un ejemplo de lo que es la verdadera literatura! ¡Este libro es un ejemplo de lo que es la verdadera literatura! ¡Este libro es un ejemplo de lo que es la verdadera literatura! ¡Este libro es un ejemplo de lo que es la verdadera literatura
Brian W. Aldiss	A cabeza descalza		80 historias cortas de ciencia ficción de este autor británico, escrito durante más de cuarenta años. Los relatos cubren un amplio espectro del género, desde historias de aventura hasta obras más reflexivas y filosóficas, y se presentan aquí en orden cronológico.
Brian W. Aldiss	Afuera		1993. La última generación humana se ha ido. Los humanoides que les han sucedido han construido una utópica sociedad tecnológicamente avanzada en la que la vida es un placer, pero hay una maldición. Algunos seres humanos han sobrevivido, y ahora están forzados a sobrevivir en la selva. Eso es lo que es el mundo de Afuera, un lugar hostil, peligroso y lleno de misterios. El libro de Brian W. Aldiss es una gran obra de ciencia ficción que habla de la supervivencia y la lucha por la vida en un mundo postapocalíptico.
Brian W. Aldiss	Barbagris		1959. El mundo está en ruinas. La civilización se ha colapsado. El mundo está poblado por caníbales, hombres y mujeres que se alimentan de los cadáveres de sus víctimas, de los que han perdido la razón. El único refugio de la humanidad es una pequeña isla, donde se han refugiado algunos supervivientes. Aquí, los que se han salvado intentan vivir en paz, llenos de la más pura compasión. Pero la isla está en peligro: un barco ha llegado a sus costas, llevando consigo a la última esperanza de la civilización: un pequeño grupo de científicos, que han aceptado la tarea de reconstruir el mundo. Pero a cambio, deben entregarles un cuer
Brian W. Aldiss	Capullo en flor		1957. La Tierra ha sido destruida por la radiación. Los supervivientes viven en las profundidades de la Tierra, donde han construido una sociedad cerrada y estable. La historia se centra en la tranquila vida de John Chalmers, un científico que se enfrenta a la posibilidad de que la Tierra pueda recuperarse y que se produzcan nuevos seres vivientes.
Brian W. Aldiss	Como se puede reemplazar a un hombre		1961: Un hombre muere en un accidente de tráfico. Se dice que la muerte es un gran vacío en la existencia de los demás, que el mundo se vuelve más silencioso, menos luminoso. Pero eso es solo una opinión, una opinión errónea. La muerte de un hombre puede ser muchas otras cosas. 1991: Un hombre muere en un accidente de tráfico. Se dice que la muerte es una gran pérdida en la existencia de los demás, que el mundo se vuelve más oscuro, menos luminoso. Pero eso es solo una opinión, una opinión errónea. La muerte de un hombre puede ser muchas otras cosas. Brian W. Aldiss, autor de algunos de los libros más originales y aclamados de la literatura de
Brian W. Aldiss	Criaturas del apogeo		1974. Una civilización avanzada y rica ha perdido su capacidad de procrear. Los seres humanos se han convertido en criaturas de laboratorio y se han vuelto dependientes de los robots que les han sustituido. La humanidad se encuentra en un proceso de decadencia y están preparados para morir. ¡Unas historias inolvidables!
Brian W. Aldiss	Cuando la tierra este muerta		1971. La tierra ha muerto. La humanidad ha estado preparándose durante décadas para abandonar la tierra y colonizar el espacio. Los últimos humanos que quedan se han retirado a las estaciones espaciales en órbita de Marte, y se están preparando para la gran migración. Pero algunos se han quedado atrás, como el veterano astronauta John Traven, quien se ha quedado en la antigua tierra para intentar descubrir la verdad detrás de la misteriosa muerte de la tierra.
Brian W. Aldiss	Dracula desencadenado		100 años después de la publicación de la novela clásica de Bram Stoker, Brian W. Aldiss retoma el tema del vampiro en un relato original que se aleja de la fórmula clásica. El lector se sumerge en un relato de suspense y misterio en el que un científico aplicado a la genética intenta crear una nueva especie de vampiros, con resultados inesperados.
Brian W. Aldiss	El arbol de saliva	https://covers.openlibrary.org/b/id/5265818-L.jpg	¡Un clásico de la ciencia ficción! El arbol de saliva es un libro que se ha convertido en referencia en el mundo de la ciencia ficción. Brian W. Aldiss nos presenta en este libro una visión del futuro donde la tecnología ha desempeñado un papel decisivo en la vida cotidiana. El arbol de saliva es una obra maestra de la ciencia ficción que sigue siendo un clásico hoy en día.
Brian W. Aldiss	El exterior	https://covers.openlibrary.org/b/id/12774038-L.jpg	1974. En un futuro cercano, el planeta ha sufrido una catástrofe ambiental que ha obligado a los humanos a vivir en bolsas herméticas aisladas de la contaminación del exterior. En medio de esas bolsas, dos hombres se enfrentan a un misterioso extraño que parece haber sobrevivido a la catástrofe.
Brian W. Aldiss	El hombre en su tiempo		Índice de temas: La era prehistórica, El hombre primitivo, La revolución neolítica, El hombre del bronce, El hombre de la Edad del Hierro, La Edad Antigua, La Edad Media, El hombre de la Edad Moderna, La era contemporánea.
Brian W. Aldiss	El suave dilema		1983. Un mundo en el que la tecnología ha avanzado más allá de las expectativas. Los humanos han conseguido la inmortalidad gracias al cuerpo sintético, pero no ha sido posible preservar la mente. Las personas son enterradas con una cópula de su cuerpo sintético y un contenido de memoria hasta que un día el sistema detecte una mente humana dispuesta a habitarlo.
Brian W. Aldiss	El tapiz de malacia		1985, Londres. Una ciudad en decadencia. Un tapiz de malacia. Los supervivientes se agrupan en gangas y se dedican al pillaje y al asesinato. Los que quieren escapar se esconden en el subterráneo, en el metro. Un día, una chica llamada Judy entra en la red, y descubre que, a pesar de todo, el subterráneo sigue teniendo un sistema de comunicación, y eso quiere decir que hay otros sobrevivientes.
Brian W. Aldiss	El verano casi habia concluido		1993. Una colonia de colonos se establece en una luna deshabitada. Pero el verano, que durará un año, se prolonga indefinidamente. Y el grupo se divide en dos bandos: aquellos que se alegran por la eterna luz y los que quieren volver a la Tierra. Aldiss, un maestro del relato corto, ofrece una fábula de ciencia ficción que se desenvuelve en un universo de cambio constante.
Brian W. Aldiss	En la arena	https://covers.openlibrary.org/b/id/11622355-L.jpg	600 años después de la muerte de la humanidad, la Tierra ha vuelto a ser un planeta habitado por otras formas de vida. La historia de esta transformación se cuenta a través de los diarios de una mujer que vive en una colonia humana clandestina en el antiguo Terranova.
